"id"	"geneNum"	"description"	"BaiduTrans"	"definition"	"gene"
"GO:0005886"	"515"	"plasma membrane"	"质膜"	"The membrane surrounding a cell that separates the cell from its external environment. It consists of a phospholipid bilayer and associated proteins."	"YAL005C,YAL022C,YAL024C,YAL026C,YAL030W,YAL056W,YAR027W,YAR031W,YAR033W,YAR042W,YAR050W,YAR066W,YBL007C,YBL029C-A,YBL037W,YBL042C,YBL047C,YBL060W,YBL061C,YBL069W,YBL075C,YBL085W,YBL091C-A,YBL101C,YBL106C,YBR005W,YBR008C,YBR016W,YBR021W,YBR023C,YBR041W,YBR043C,YBR054W,YBR068C,YBR069C,YBR078W,YBR086C,YBR129C,YBR132C,YBR196C,YBR207W,YBR264C,YBR294W,YBR295W,YBR296C,YBR299W,YCL025C,YCL027W,YCL048W,YCL048W-A,YCL058C,YCL073C,YCR004C,YCR010C,YCR017C,YCR021C,YCR024C-A,YCR027C,YCR028C,YCR030C,YCR037C,YCR038C,YCR075C,YCR091W,YCR094W,YCR098C,YDL012C,YDL019C,YDL035C,YDL124W,YDL135C,YDL137W,YDL138W,YDL161W,YDL192W,YDL194W,YDL222C,YDL223C,YDL229W,YDL245C,YDL247W,YDR011W,YDR032C,YDR033W,YDR038C,YDR039C,YDR040C,YDR050C,YDR055W,YDR090C,YDR093W,YDR099W,YDR103W,YDR122W,YDR129C,YDR144C,YDR153C,YDR158W,YDR160W,YDR164C,YDR208W,YDR210W,YDR261C,YDR276C,YDR309C,YDR326C,YDR342C,YDR343C,YDR345C,YDR348C,YDR373W,YDR384C,YDR420W,YDR459C,YDR461W,YDR463W,YDR497C,YDR522C,YDR524C-B,YDR536W,YEL017C-A,YEL047C,YEL063C,YEL069C,YER008C,YER020W,YER048C,YER056C,YER060W,YER060W-A,YER067W,YER093C,YER103W,YER118C,YER120W,YER123W,YER125W,YER143W,YER145C,YER155C,YER166W,YER177W,YER185W,YFL005W,YFL011W,YFL014W,YFL026W,YFL041W,YFL042C,YFL047W,YFL050C,YFL051C,YFL054C,YFR012W,YFR022W,YFR029W,YGL008C,YGL045W,YGL051W,YGL053W,YGL082W,YGL084C,YGL108C,YGL114W,YGL160W,YGL167C,YGL186C,YGL208W,YGL233W,YGL255W,YGR009C,YGR014W,YGR026W,YGR031C-A,YGR032W,YGR041W,YGR055W,YGR060W,YGR065C,YGR068C,YGR086C,YGR121C,YGR122W,YGR131W,YGR138C,YGR143W,YGR152C,YGR167W,YGR191W,YGR192C,YGR197C,YGR198W,YGR212W,YGR213C,YGR217W,YGR221C,YGR224W,YGR241C,YGR256W,YGR266W,YGR281W,YGR289C,YGR292W,YHL007C,YHL016C,YHL040C,YHL044W,YHR005C,YHR006W,YHR022C,YHR028C,YHR042W,YHR048W,YHR050W,YHR073W,YHR080C,YHR092C,YHR094C,YHR096C,YHR114W,YHR126C,YHR135C,YHR155W,YHR161C,YHR182W,YHR186C,YHR214W,YIL009W,YIL033C,YIL043C,YIL047C,YIL048W,YIL088C,YIL105C,YIL118W,YIL120W,YIL121W,YIL140W,YIL147C,YIR006C,YIR019C,YIR028W,YIR038C,YIR039C,YJL005W,YJL052W,YJL058C,YJL062W,YJL085W,YJL093C,YJL100W,YJL129C,YJL138C,YJL145W,YJL156C,YJL158C,YJL170C,YJL171C,YJL198W,YJL212C,YJL214W,YJL219W,YJR005W,YJR040W,YJR054W,YJR058C,YJR059W,YJR065C,YJR066W,YJR086W,YJR100C,YJR125C,YJR152W,YJR158W,YJR160C,YKL007W,YKL035W,YKL046C,YKL051W,YKL094W,YKL105C,YKL126W,YKL129C,YKL135C,YKL178C,YKL187C,YKL196C,YKL203C,YKL209C,YKL217W,YKL220C,YKR014C,YKR019C,YKR039W,YKR050W,YKR055W,YKR093W,YKR100C,YKR105C,YKR106W,YLL005C,YLL007C,YLL010C,YLL024C,YLL028W,YLL038C,YLL043W,YLL050C,YLL051C,YLL052C,YLL053C,YLL055W,YLL061W,YLR004C,YLR019W,YLR020C,YLR025W,YLR034C,YLR047C,YLR058C,YLR072W,YLR081W,YLR084C,YLR087C,YLR092W,YLR096W,YLR109W,YLR120C,YLR121C,YLR130C,YLR138W,YLR187W,YLR194C,YLR206W,YLR214W,YLR219W,YLR229C,YLR237W,YLR241W,YLR262C,YLR299W,YLR303W,YLR305C,YLR310C,YLR332W,YLR342W,YLR343W,YLR353W,YLR373C,YLR411W,YLR413W,YLR414C,YLR422W,YLR432W,YLR443W,YLR452C,YLR454W,YML006C,YML013W,YML047C,YML052W,YML072C,YML087C,YML116W,YML123C,YML125C,YML128C,YML132W,YMR006C,YMR008C,YMR011W,YMR017W,YMR031C,YMR032W,YMR034C,YMR058W,YMR063W,YMR068W,YMR086W,YMR109W,YMR120C,YMR162C,YMR183C,YMR186W,YMR192W,YMR212C,YMR215W,YMR238W,YMR246W,YMR251W-A,YMR266W,YMR306W,YMR307W,YMR319C,YNL006W,YNL012W,YNL019C,YNL033W,YNL047C,YNL065W,YNL084C,YNL087W,YNL090W,YNL093W,YNL098C,YNL128W,YNL142W,YNL145W,YNL154C,YNL173C,YNL180C,YNL183C,YNL192W,YNL194C,YNL209W,YNL231C,YNL243W,YNL257C,YNL271C,YNL275W,YNL279W,YNL283C,YNL291C,YNL293W,YNL294C,YNL318C,YNL322C,YNL323W,YNR002C,YNR047W,YNR048W,YNR049C,YNR060W,YNR070W,YNR072W,YOL002C,YOL009C,YOL011W,YOL019W,YOL020W,YOL030W,YOL078W,YOL084W,YOL086C,YOL103W,YOL109W,YOL113W,YOL122C,YOL130W,YOL132W,YOL152W,YOL156W,YOL158C,YOR008C,YOR011W,YOR018W,YOR030W,YOR047C,YOR049C,YOR071C,YOR086C,YOR087W,YOR089C,YOR101W,YOR104W,YOR129C,YOR153W,YOR161C,YOR171C,YOR192C,YOR212W,YOR219C,YOR273C,YOR301W,YOR306C,YOR317W,YOR322C,YOR327C,YOR328W,YOR371C,YOR378W,YOR381W,YOR384W,YOR390W,YPL004C,YPL036W,YPL056C,YPL058C,YPL092W,YPL158C,YPL176C,YPL180W,YPL204W,YPL232W,YPL240C,YPL249C,YPL265W,YPL274W,YPL279C,YPR030W,YPR032W,YPR055W,YPR075C,YPR117W,YPR124W,YPR138C,YPR149W,YPR156C,YPR159W,YPR165W,YPR171W,YPR192W,YPR194C,YPR198W,YPR201W"
"GO:0005891"	"1"	"voltage-gated calcium channel complex"	"电压门控钙通道复合体"	"A protein complex that forms a transmembrane channel through which calcium ions may pass in response to changes in membrane potential."	"YGR217W"
"GO:0005905"	"10"	"clathrin-coated pit"	"氯氰菊酯涂层坑"	"A part of the endomembrane system in the form of an invagination of a membrane upon which a clathrin coat forms, and that can be converted by vesicle budding into a clathrin-coated vesicle. Coated pits form on the plasma membrane, where they are involved in receptor-mediated selective transport of many proteins and other macromolecules across the cell membrane, in the trans-Golgi network, and on some endosomes."	"YBL037W,YGL206C,YGR167W,YGR241C,YHR161C,YJR005W,YJR058C,YKL135C,YOL062C,YPL259C"
"GO:0005933"	"61"	"cellular bud"	"细胞芽"	"A protuberance from a cell of an organism that reproduces by budding, which will grow larger and become a separate daughter cell after nuclear division, cytokinesis, and cell wall formation (when appropriate). The daughter cell may completely separate from the mother cell, or the mother and daughter cells may remain associated."	"YAL024C,YAL029C,YAL030W,YBL085W,YBR054W,YBR102C,YBR158W,YBR260C,YDL012C,YDL146W,YDL240W,YDR033W,YDR251W,YDR293C,YER033C,YER114C,YER118C,YER149C,YFL034C-B,YFR016C,YGR221C,YGR241C,YHR102W,YHR161C,YIL034C,YIL118W,YIL129C,YIR004W,YJL051W,YJL085W,YJL204C,YJR031C,YKL046C,YKL185W,YKL189W,YKR090W,YKR100C,YLR187W,YLR190W,YLR324W,YLR342W,YLR414C,YML072C,YMR109W,YMR192W,YMR295C,YNL087W,YNL161W,YNL166C,YNL283C,YNL293W,YNL298W,YNL327W,YOL112W,YOR165W,YOR304C-A,YOR327C,YOR353C,YPL032C,YPL249C,YPR028W"
"GO:0005934"	"102"	"cellular bud tip"	"细胞芽尖"	"The end of a cellular bud distal to the site of attachment to the mother cell."	"YAL016W,YAL029C,YAL041W,YAR014C,YBL047C,YBL060W,YBR017C,YBR102C,YBR109C,YBR130C,YBR200W,YCR017C,YCR030C,YDL127W,YDL135C,YDL161W,YDL240W,YDR129C,YDR150W,YDR164C,YDR166C,YDR251W,YDR309C,YDR348C,YDR388W,YDR496C,YER008C,YER033C,YER120W,YER125W,YER149C,YER155C,YFL034C-B,YFL047W,YFR016C,YGL106W,YGL190C,YGL233W,YGR058W,YGR221C,YGR238C,YHR030C,YHR061C,YHR142W,YHR149C,YHR158C,YHR182W,YIL034C,YIL068C,YJL085W,YJL128C,YJL158C,YKL007W,YKL079W,YKL130C,YKR090W,YKR100C,YLL021W,YLR084C,YLR096W,YLR110C,YLR114C,YLR187W,YLR190W,YLR229C,YLR313C,YLR319C,YLR342W,YLR353W,YLR371W,YML047C,YML109W,YMR192W,YMR273C,YNL116W,YNL161W,YNL243W,YNL271C,YNL272C,YNL293W,YNL304W,YNR031C,YNR049C,YOL112W,YOR046C,YOR094W,YOR188W,YOR231W,YOR247W,YOR301W,YOR304C-A,YOR326W,YPL032C,YPL115C,YPL140C,YPL158C,YPL204W,YPL249C,YPR028W,YPR055W,YPR165W,YPR171W"
"GO:0005935"	"191"	"cellular bud neck"	"细胞芽颈"	"The constriction between the mother cell and daughter cell (bud) in an organism that reproduces by budding."	"YAL016W,YAL030W,YAL041W,YAR014C,YAR019C,YBL007C,YBL031W,YBL037W,YBL047C,YBL060W,YBL061C,YBL085W,YBL105C,YBL106C,YBR017C,YBR023C,YBR038W,YBR059C,YBR071W,YBR102C,YBR109C,YBR133C,YBR160W,YBR200W,YCL014W,YCL024W,YCL051W,YCR002C,YCR017C,YCR030C,YCR038C,YDL019C,YDL025C,YDL117W,YDL127W,YDL135C,YDL146W,YDL161W,YDL179W,YDL225W,YDL240W,YDR093W,YDR164C,YDR166C,YDR218C,YDR251W,YDR293C,YDR309C,YDR348C,YDR409W,YDR507C,YDR508C,YER008C,YER032W,YER033C,YER114C,YER118C,YER120W,YER124C,YER133W,YER144C,YER149C,YER166W,YFL034C-B,YFL047W,YFR016C,YFR024C-A,YFR028C,YGL106W,YGL181W,YGL190C,YGL210W,YGL233W,YGR032W,YGR040W,YGR041W,YGR058W,YGR059W,YGR092W,YGR152C,YGR221C,YGR229C,YGR238C,YGR241C,YHR023W,YHR030C,YHR061C,YHR107C,YHR114W,YHR142W,YHR149C,YHR158C,YHR161C,YIL068C,YIL106W,YIL117C,YIL140W,YIL159W,YIR006C,YIR019C,YJL085W,YJL095W,YJL128C,YJL187C,YJL204C,YJR058C,YJR076C,YJR092W,YKL007W,YKL048C,YKL079W,YKL092C,YKL101W,YKL126W,YKR048C,YKR055W,YKR090W,YLL021W,YLR084C,YLR096W,YLR114C,YLR166C,YLR187W,YLR190W,YLR194C,YLR229C,YLR286C,YLR313C,YLR314C,YLR319C,YLR337C,YLR342W,YLR425W,YML109W,YMR001C,YMR032W,YMR034C,YMR124W,YMR192W,YMR273C,YNL058C,YNL078W,YNL152W,YNL154C,YNL161W,YNL166C,YNL233W,YNL243W,YNL271C,YNL272C,YNL278W,YNL293W,YNL304W,YNR031C,YNR049C,YNR067C,YOL007C,YOL070C,YOL112W,YOR008C,YOR014W,YOR093C,YOR094W,YOR104W,YOR127W,YOR129C,YOR188W,YOR231W,YOR233W,YOR237W,YOR264W,YOR301W,YOR304C-A,YOR326W,YPL032C,YPL066W,YPL116W,YPL140C,YPL158C,YPL204W,YPL221W,YPL242C,YPL249C,YPR055W,YPR111W,YPR119W,YPR122W,YPR159W,YPR165W,YPR171W,YPR188C"
"GO:0005937"	"7"	"mating projection"	"交配投影"	"The projection formed by unicellular fungi in response to mating pheromone."	"YCR009C,YCR089W,YDL223C,YHR107C,YJR054W,YLR313C,YOR212W"
"GO:0005938"	"45"	"cell cortex"	"细胞皮层"	"The region of a cell that lies just beneath the plasma membrane and often, but not always, contains a network of actin filaments and associated proteins."	"YBL007C,YBR200W,YCL027W,YCL029C,YCL034W,YCR038C,YCR088W,YDL222C,YDR034W-B,YDR150W,YDR309C,YDR348C,YDR389W,YDR490C,YER072W,YER155C,YFL004W,YHR061C,YHR158C,YIL129C,YJL012C,YKL116C,YKR054C,YLL021W,YLR407W,YML052W,YMR032W,YNL078W,YNL161W,YNL194C,YNL243W,YNR031C,YOL100W,YOR122C,YOR129C,YOR134W,YOR233W,YPL004C,YPL019C,YPL032C,YPL074W,YPL115C,YPL141C,YPL242C,YPL269W"
"GO:0005940"	"12"	"septin ring"	"septin环"	"A tight ring-shaped structure that forms in the division plane at the site of cytokinesis; composed of members of the conserved family of filament-forming proteins called septins as well as septin-associated proteins. This type of septin structure is observed at the bud neck of budding fungal cells, at the site of cell division in animal cells, at the junction between the mother cell and a pseudohyphal projection, and also within hyphae of filamentous fungi at sites where a septum will form."	"YCL024W,YCR002C,YDL225W,YDR218C,YDR409W,YDR510W,YGR059W,YHR107C,YJR076C,YLR229C,YLR314C,YNL233W"
"GO:0005942"	"1"	"phosphatidylinositol 3-kinase complex"	"磷脂酰肌醇3-激酶复合物"	"A protein complex capable of phosphatidylinositol 3-kinase activity and containing subunits of any phosphatidylinositol 3-kinase (PI3K) enzyme. These complexes are divided in three classes (called I, II and III) that differ for their presence across taxonomic groups and for the type of their constituents. Catalytic subunits of phosphatidylinositol 3-kinase enzymes are present in all 3 classes; regulatory subunits of phosphatidylinositol 3-kinase enzymes are present in classes I and III; adaptor proteins have been observed in class II complexes and may be present in other classes too."	"YBR097W"
"GO:0005945"	"2"	"6-phosphofructokinase complex"	"6-磷酸果糖激酶复合物"	"A protein complex that possesses 6-phosphofructokinase activity; homodimeric, homooctameric, and allosteric homotetrameric forms are known."	"YGR240C,YMR205C"
"GO:0005946"	"4"	"alpha,alpha-trehalose-phosphate synthase complex (UDP-forming)"	"α，α-海藻糖磷酸合酶复合物（UDP形成）"	"A protein complex that possesses alpha,alpha-trehalose-phosphate synthase (UDP-forming) and trehalose-phosphatase activities, and thus catalyzes two reactions in trehalose biosynthesis. In the complex identified in Saccharomyces, Tps1p has alpha,alpha-trehalose-phosphate synthase (UDP-forming) activity, Tps2p has trehalose 6-phosphate phosphatase activity; Tps3p is a regulatory subunit, and an additional subunit, Tsl1p, may be present."	"YBR126C,YDR074W,YML100W,YMR261C"
"GO:0005948"	"2"	"acetolactate synthase complex"	"乙酰乳酸合酶复合物"	"A dimeric (a large and a small chain) or tetrameric (two large and two small chains) enzyme complex. Catalyzes the formation of acetolactate from pyruvate."	"YCL009C,YMR108W"
"GO:0005950"	"2"	"anthranilate synthase complex"	"邻氨基苯甲酸合酶复合物"	"A heterotetrameric enzyme complex made up of two components I and two components II. Catalyzes the formation of anthranilate, pyruvate and L-glutamate from chorismate and L-glutamine."	"YER090W,YKL211C"
"GO:0005951"	"2"	"carbamoyl-phosphate synthase complex"	"氨甲酰磷酸合酶复合物"	"A protein complex that catalyzes the formation of carbamoyl phosphate; comprises a small subunit that binds and cleaves glutamine, and a large subunit that accepts the ammonia group cleaved from glutamine, binds all of the remaining substrates and effectors, and carries out all of the other catalytic events."	"YJR109C,YOR303W"
"GO:0005952"	"4"	"cAMP-dependent protein kinase complex"	"cAMP依赖性蛋白激酶复合物"	"An enzyme complex, composed of regulatory and catalytic subunits, that catalyzes protein phosphorylation. Inactive forms of the enzyme have two regulatory chains and two catalytic chains; activation by cAMP produces two active catalytic monomers and a regulatory dimer."	"YIL033C,YJL164C,YKL166C,YPL203W"
"GO:0005953"	"2"	"CAAX-protein geranylgeranyltransferase complex"	"CAAX蛋白香叶基基转移酶复合物"	"A heterodimeric enzyme, composed of an alpha and a beta subunit. Participates in the post-translational C-terminal modification of several small GTPases, allowing their targeting to the membrane."	"YGL155W,YKL019W"
"GO:0005955"	"3"	"calcineurin complex"	"钙调神经磷酸酶复合物"	"A heterodimeric calcium ion and calmodulin dependent protein phosphatase composed of catalytic and regulatory subunits; the regulatory subunit is very similar in sequence to calmodulin."	"YKL190W,YLR433C,YML057W"
"GO:0005956"	"4"	"protein kinase CK2 complex"	"蛋白激酶CK2复合物"	"A protein complex that possesses protein serine/threonine kinase activity, and contains two catalytic alpha subunits and two regulatory beta subunits. Protein kinase CK2 complexes are found in nearly every subcellular compartment, and can phosphorylate many protein substrates in addition to casein."	"YGL019W,YIL035C,YOR039W,YOR061W"
"GO:0005960"	"4"	"glycine cleavage complex"	"甘氨酸裂解复合物"	"A protein complex that catalyzes the reversible oxidation of glycine. In E. coli, it has four components: dihydrolipoamide dehydrogenase, glycine dehydrogenase (decarboxylating), lipoyl-GcvH-protein and aminomethyltransferase, also known as L, P, H, and T."	"YAL044C,YDR019C,YFL018C,YMR189W"
"GO:0005962"	"2"	"mitochondrial isocitrate dehydrogenase complex (NAD+)"	"线粒体异柠檬酸脱氢酶复合物（NAD+）"	"Mitochondrial complex that possesses isocitrate dehydrogenase (NAD+) activity."	"YNL037C,YOR136W"
"GO:0005965"	"2"	"protein farnesyltransferase complex"	"蛋白法尼基转移酶复合物"	"A protein complex that possesses protein farnesyltransferase activity."	"YDL090C,YKL019W"
"GO:0005967"	"5"	"mitochondrial pyruvate dehydrogenase complex"	"线粒体丙酮酸脱氢酶复合物"	"Complex that carries out the oxidative decarboxylation of pyruvate to form acetyl-CoA in eukaryotes; includes subunits possessing three catalytic activities: pyruvate dehydrogenase (E1), dihydrolipoamide S-acetyltransferase (E2), and dihydrolipoamide dehydrogenase (E3). The This Eukaryotic form usually contains more subunits than its bacterial counterpart; for example, one known complex contains 30 E1 dimers, 60 E2 monomers, and 6 E3 dimers as well as a few copies of pyruvate dehydrogenase kinase and pyruvate dehydrogenase phosphatase."	"YBR221C,YER178W,YFL018C,YGR193C,YNL071W"
"GO:0005968"	"4"	"Rab-protein geranylgeranyltransferase complex"	"Rab蛋白香叶基基转移酶复合物"	"An protein-containing complex which catalyzes of the transfer of a geranyl-geranyl group from geranylgeranyl pyrophosphate to a Rab protein. In mammals it is composed of an alpha and a beta subunit, and associates with an accessory protein Rep (Rab escort protein)."	"YJL031C,YKR004C,YOR370C,YPR176C"
"GO:0005971"	"4"	"ribonucleoside-diphosphate reductase complex"	"核糖核苷二磷酸还原酶复合物"	"An enzyme complex composed of 2-4 or more subunits, which usually contains nonheme iron and requires ATP for catalysis. Catalyzes the formation of 2'-deoxyribonucleoside diphosphate from ribonucleoside diphosphate, using either thioredoxin disulfide or glutaredoxin disulfide as an acceptor."	"YER070W,YGR180C,YIL066C,YJL026W"
"GO:0008023"	"3"	"transcription elongation factor complex"	"转录延伸因子复合物"	"Any protein complex that interacts with RNA polymerase II to increase (positive transcription elongation factor) or reduce (negative transcription elongation factor) the rate of transcription elongation."	"YGR116W,YKL160W,YPL101W"
"GO:0008024"	"3"	"cyclin/CDK positive transcription elongation factor complex"	"细胞周期蛋白/CDK阳性转录延伸因子复合物"	"A transcription elongation factor complex that facilitates the transition from abortive to productive elongation by phosphorylating the CTD domain of the large subunit of DNA-directed RNA polymerase II, holoenzyme. Contains a cyclin and a cyclin-dependent protein kinase catalytic subunit."	"YJL006C,YKL139W,YLR226W"
"GO:0008180"	"6"	"COP9 signalosome"	"COP9信号体"	"A protein complex that catalyzes the deneddylation of proteins, including the cullin component of SCF ubiquitin E3 ligase; deneddylation increases the activity of cullin family ubiquitin ligases. The signalosome is involved in many regulatory process, including some which control development, in many species; also regulates photomorphogenesis in plants; in many species its subunits are highly similar to those of the proteasome."	"YDL147W,YDL216C,YDR179C,YIL071C,YMR025W,YOL117W"
"GO:0008250"	"9"	"oligosaccharyltransferase complex"	"寡糖基转移酶复合物"	"A protein complex that is found in the endoplasmic reticulum membrane of eukaryotes and transfers lipid-linked oligosaccharide precursor to asparagine residues on nascent proteins. In yeast, the complex includes at least nine different subunits, whereas in mammalian cells at least three different forms of the complex have been detected."	"YDL232W,YEL002C,YGL022W,YGL226C-A,YJL002C,YML019W,YMR149W,YOR085W,YOR103C"
"GO:0008275"	"3"	"gamma-tubulin small complex"	"γ-微管蛋白小复合体"	"A complex usually comprising two gamma-tubulin molecules and two conserved non-tubulin proteins. Some gamma-tubulin small complexes are thought to be the repeating unit making up the core of the gamma-tubulin ring complex."	"YHR172W,YLR212C,YNL126W"
"GO:0008278"	"4"	"cohesin complex"	"粘蛋白复合体"	"A protein complex that is required for sister chromatid cohesion in eukaryotes. The cohesin complex forms a molecular ring complex, and is composed of structural maintenance of chromosomes (SMC) and kleisin proteins. For example, in yeast, the complex is composed of the SMC proteins Smc1p and Smc3p, and the kleisin protein Scc1p. In vertebrates, the complex is composed of the SMC1 (SMC1A or SMC1B) and SMC3 heterodimer attached via their hinge domains to a kleisin (RAD21, REC8 or RAD21L) which links them, and one STAG protein (STAG1, STAG2 or STAG3)."	"YDL003W,YFL008W,YIL026C,YPR007C"
"GO:0008290"	"2"	"F-actin capping protein complex"	"肌动蛋白帽蛋白复合物"	"A heterodimer consisting of alpha and beta subunits that binds to and caps the barbed ends of actin filaments, thereby regulating the polymerization of actin monomers but not severing actin filaments."	"YIL034C,YKL007W"
"GO:0008540"	"9"	"proteasome regulatory particle, base subcomplex"	"蛋白酶体调节颗粒，碱基亚复合物"	"The subcomplex of the proteasome regulatory particle that directly associates with the proteasome core complex."	"YDL007W,YDR394W,YGL048C,YHR027C,YHR200W,YIL075C,YKL145W,YOR117W,YOR259C"
"GO:0008541"	"10"	"proteasome regulatory particle, lid subcomplex"	"蛋白酶体调节颗粒，lid亚复合物"	"The subcomplex of the proteasome regulatory particle that forms the peripheral lid, which is added on top of the base subcomplex."	"YDL097C,YDL147W,YDR363W-A,YDR427W,YER021W,YFR004W,YFR052W,YLR421C,YOR261C,YPR108W"
"GO:0008622"	"4"	"epsilon DNA polymerase complex"	"ε-DNA聚合酶复合物"	"A heterotetrameric DNA polymerase complex that catalyzes processive DNA synthesis in the absence of PCNA, but is further stimulated in the presence of PCNA. The complex contains a large catalytic subunit and three small subunits, and is best characterized in Saccharomyces, in which the subunits are named Pol2p, Dpb2p, Dpb3p, and Dpb4p. Some evidence suggests that DNA polymerase epsilon is the leading strand polymerase; it is also involved in nucleotide-excision repair and mismatch repair."	"YBR278W,YDR121W,YNL262W,YPR175W"
"GO:0008623"	"5"	"CHRAC"	"CHRAC"	"An ISWI complex that contains an ATPase subunit of the ISWI family (SNF2H in mammals, Isw2 in S. cerevisiae), an ACF1 homolog, and additional small histone fold subunits (generally two of these, but Xenopus has only one and some additional non-conserved subunits). CHRAC plays roles in the regulation of RNA polymerase II transcription and in DNA replication and repair."	"YBR278W,YDR121W,YGL133W,YJL065C,YOR304W"
"GO:0009277"	"114"	"fungal-type cell wall"	"真菌型细胞壁"	"A rigid yet dynamic structure surrounding the plasma membrane that affords protection from stresses and contributes to cell morphogenesis, consisting of extensively cross-linked glycoproteins and carbohydrates. The glycoproteins may be modified with N- or O-linked carbohydrates, or glycosylphosphatidylinositol (GPI) anchors; the polysaccharides are primarily branched glucans, including beta-linked and alpha-linked glucans, and may also include chitin and other carbohydrate polymers, but not cellulose or pectin. Enzymes involved in cell wall biosynthesis are also found in the cell wall. Note that some forms of fungi develop a capsule outside of the cell wall under certain circumstances; this is considered a separate structure."	"YAL005C,YAL063C,YAL068C,YAR050W,YAR071W,YBL108C-A,YBR040W,YBR067C,YBR078W,YBR092C,YBR093C,YBR162C,YBR301W,YCL048W,YCR089W,YCR104W,YDL024C,YDR055W,YDR077W,YDR144C,YDR261C,YDR349C,YDR522C,YDR534C,YDR542W,YEL040W,YEL049W,YER011W,YER150W,YFL020C,YGL028C,YGL032C,YGL261C,YGR189C,YGR192C,YGR279C,YGR282C,YGR294W,YHL046C,YHR143W,YHR211W,YHR215W,YIL011W,YIL015W,YIL123W,YIL169C,YIL176C,YIR039C,YIR041W,YJL052W,YJL078C,YJL116C,YJL158C,YJL159W,YJL160C,YJL171C,YJL223C,YJR004C,YJR009C,YJR091C,YJR150C,YJR151C,YKL096W,YKL096W-A,YKL163W,YKL164C,YKL165C,YKL224C,YKR042W,YKR102W,YLL024C,YLL025W,YLL064C,YLR037C,YLR040C,YLR042C,YLR120C,YLR121C,YLR194C,YLR213C,YLR286C,YLR300W,YLR390W-A,YLR461W,YMR006C,YMR215W,YMR305C,YMR307W,YMR325W,YNL066W,YNL190W,YNL300W,YNL322C,YNL327W,YNR044W,YNR067C,YNR076W,YOL030W,YOL132W,YOL154W,YOL155C,YOL161C,YOR009W,YOR010C,YOR190W,YOR214C,YOR247W,YOR382W,YOR383C,YOR394W,YPL130W,YPL163C,YPL282C,YPR026W"
"GO:0009316"	"1"	"3-isopropylmalate dehydratase complex"	"3-异丙基苹果酸脱水酶复合物"	"A heterodimeric enzyme complex composed of subunits leuC and leuD. Catalyzes the isomerization between 2-isopropylmalate and 3-isopropylmalate, via the formation of 2-isopropylmaleate."	"YGL009C"
"GO:0009328"	"2"	"phenylalanine-tRNA ligase complex"	"苯丙氨酸tRNA连接酶复合物"	"An enzyme complex that catalyzes the ligation of phenylalanine to tRNA(Phe), forming L-phenylalanyl-tRNA(Phe)."	"YFL022C,YLR060W"
"GO:0009331"	"2"	"glycerol-3-phosphate dehydrogenase complex"	"甘油-3-磷酸脱氢酶复合物"	"An enzyme complex that catalyzes the dehydrogenation of sn-glycerol 3-phosphate to form glycerone phosphate."	"YIL155C,YOL059W"
"GO:0009337"	"2"	"sulfite reductase complex (NADPH)"	"亚硫酸盐还原酶复合物（NADPH）"	"A multisubunit iron flavoprotein, which in yeast is composed of 2 alpha and 2 beta subunits. Catalyzes the reduction of sulfite to sulfide."	"YFR030W,YJR137C"
"GO:0009353"	"3"	"mitochondrial oxoglutarate dehydrogenase complex"	"线粒体酮戊二酸脱氢酶复合物"	"A complex of multiple copies of three enzymatic components: oxoglutarate dehydrogenase (lipoamide) (E1), dihydrolipoamide S-succinyltransferase  (E2) and dihydrolipoamide dehydrogenase (E3); catalyzes the overall conversion of 2-oxoglutarate to succinyl-CoA and carbon dioxide (CO2) within the mitochondrial matrix. An example of this complex is found in Mus musculus."	"YFL018C,YFR049W,YIL125W"
"GO:0009361"	"1"	"succinate-CoA ligase complex (ADP-forming)"	"琥珀酸辅酶A连接酶复合物（ADP形成）"	"A heterodimeric enzyme complex, composed of an alpha and beta chain, most usually found in (but not limited to) bacteria. Functions in the TCA cycle, hydrolyzing succinyl-CoA into succinate and CoA, thereby forming ATP."	"YOR142W"
"GO:0009898"	"7"	"cytoplasmic side of plasma membrane"	"质膜细胞质侧"	"The leaflet the plasma membrane that faces the cytoplasm and any proteins embedded or anchored in it or attached to its surface."	"YBR041W,YCL008C,YDR122W,YGL045W,YHR174W,YJL049W,YLR025W"
"GO:0009986"	"18"	"cell surface"	"细胞表面"	"The external part of the cell wall and/or plasma membrane."	"YBR056W,YDR261C,YDR420W,YGL028C,YGR014W,YGR279C,YGR282C,YIL123W,YJL116C,YKR042W,YLR144C,YLR300W,YMR305C,YNL066W,YNR067C,YOL154W,YOR190W,YOR247W"
"GO:0010008"	"61"	"endosome membrane"	"内体膜"	"The lipid bilayer surrounding an endosome."	"YAL014C,YBL007C,YBR097W,YCR075C,YDL113C,YDR027C,YDR425W,YDR456W,YDR484W,YDR486C,YEL063C,YEL065W,YER125W,YER166W,YFR019W,YFR021W,YHL002W,YHL040C,YHL047C,YHR005C,YHR105W,YIL048W,YIL173W,YIR006C,YJL029C,YJL036W,YJR040W,YJR066W,YJR102C,YKL002W,YKL041W,YKL124W,YKL213C,YKR020W,YKR035W-A,YLL040C,YLR025W,YLR083C,YLR181C,YLR240W,YLR360W,YLR386W,YLR417W,YMR010W,YMR077C,YMR110C,YMR171C,YNL006W,YNL084C,YNR006W,YOL018C,YOL158C,YOR069W,YOR089C,YPL002C,YPL084W,YPL120W,YPL195W,YPR079W,YPR109W,YPR165W"
"GO:0010009"	"1"	"cytoplasmic side of endosome membrane"	"内质体膜细胞质侧"	"The side (leaflet) of the endosome membrane that faces the cytoplasm."	"YDR323C"
