"id"	"geneNum"	"description"	"BaiduTrans"	"definition"	"gene"
"GO:0000015"	"5"	"phosphopyruvate hydratase complex"	"磷酸丙酮酸水合酶复合物"	"A multimeric enzyme complex, usually a dimer or an octamer, that catalyzes the conversion of 2-phospho-D-glycerate to phosphoenolpyruvate and water."	"YGR254W,YHR174W,YMR323W,YOR393W,YPL281C"
"GO:0000109"	"1"	"nucleotide-excision repair complex"	"核苷酸切除修复复合体"	"Any complex formed of proteins that act in nucleotide-excision repair."	"YDR030C"
"GO:0000110"	"3"	"nucleotide-excision repair factor 1 complex"	"核苷酸切除修复因子1复合物"	"One of several protein complexes involved in nucleotide-excision repair; possesses DNA damage recognition and endodeoxynuclease activities. In S. cerevisiae, it is composed of Rad1p, Rad10p, and Rad14p; in human the subunits are ERCC4/XPF, ERCC1 and XPA, respectively."	"YML095C,YMR201C,YPL022W"
"GO:0000111"	"3"	"nucleotide-excision repair factor 2 complex"	"核苷酸切除修复因子2复合物"	"One of several protein complexes involved in nucleotide-excision repair; possesses damaged DNA binding activity. In S. cerevisiae, it is composed of Rad4p and Rad23p."	"YDR314C,YEL037C,YER162C"
"GO:0000112"	"6"	"nucleotide-excision repair factor 3 complex"	"核苷酸切除修复因子3复合物"	"One of several protein complexes involved in nucleotide-excision repair; possesses endodeoxynuclease and DNA helicase activities. In S. cerevisiae, it is composed of Rad2p and the core TFIIH-Ssl2p complex (core TFIIH is composed of Rad3p, Tfb1p, Tfb2p, Ssl1p, Tfb4p and Tfb5p. Note that Ssl2p is also called Rad25p)."	"YDR311W,YER171W,YIL143C,YLR005W,YPL122C,YPR056W"
"GO:0000113"	"4"	"nucleotide-excision repair factor 4 complex"	"核苷酸切除修复因子4复合物"	"One of several protein complexes involved in nucleotide-excision repair; possesses DNA damage recognition and DNA-dependent ATPase activities. In S. cerevisiae, it is composed of Rad7p and Rad16p."	"YBR114W,YJR052W,YKL112W,YPL046C"
"GO:0000118"	"6"	"histone deacetylase complex"	"组蛋白脱乙酰酶复合物"	"A protein complex that possesses histone deacetylase activity."	"YMR075W,YMR263W,YNL021W,YNL097C,YOR279C,YPR068C"
"GO:0000123"	"9"	"histone acetyltransferase complex"	"组蛋白乙酰转移酶复合物"	"A protein complex that possesses histone acetyltransferase activity."	"YEL056W,YER164W,YGR252W,YJR082C,YLL022C,YOR064C,YOR244W,YPL001W,YPR023C"
"GO:0000124"	"20"	"SAGA complex"	"传奇情结"	"A SAGA-type histone acetyltransferase complex that deubiquitinates H2A and/or H2B. This complex is organized into several functional submodules: a structural core including the activator binding module and consisting of ADA1 or a homolog, members of the SPT and TAF protein families as well as promotor recruitment factor TRRAP/TRA1, a histone acetyltransferase (HAT) module consisting of GCN5/KAT2A or PCAF/KAT2B, ADA2, ADA3/NGG1, and SGF29 or homologues thereof, a histone deubiquitinase (DUB) module consisting of ATXN7/SGF73, ATXN7L3/SGF11, ENY2/SUS1 and USP22/UBP8 or homologues thereof, and in some taxa a splicing module consisting of SF3B3 and SF3B5 or homologues thereof (not in fungi). In budding yeast also contains Spt8 which distinguishes it from SAGA-like (SLIK) complex (GO:0046695)."	"YBR081C,YBR111W-A,YBR198C,YCL010C,YDR145W,YDR167W,YDR176W,YDR392W,YDR448W,YER164W,YGL066W,YGL112C,YGR252W,YHR099W,YLR055C,YMR223W,YMR236W,YOL148C,YPL047W,YPL254W"
"GO:0000126"	"3"	"transcription factor TFIIIB complex"	"转录因子TFIIIB复合物"	"A transcription factor complex that is involved in regulating transcription from RNA polymerase III (Pol III) promoters. TFIIIB contains the TATA-binding protein (TBP) and two Pol III-specific proteins, B'' and BRF."	"YER148W,YGR246C,YNL039W"
"GO:0000127"	"6"	"transcription factor TFIIIC complex"	"转录因子TFIIIC复合物"	"A heterotrimeric transcription factor complex that is involved in regulating transcription from RNA polymerase III (Pol III) promoters. TFIIIC contains three conserved subunits that associate with the proximal Pol III promoter element, and additional subunits that associate with sequence elements downstream of the promoter and are more diverged among species. It also functions as a boundary element to partition genome content into distinct domains outside Pol III promoter regions."	"YAL001C,YBR123C,YDR362C,YGR047C,YOR110W,YPL007C"
"GO:0000131"	"67"	"incipient cellular bud site"	"初生细胞芽位"	"The portion of the budding yeast plasma membrane where a daughter cell will emerge. The yeast marks this spot with bud-site selection proteins before bud emergence occurs. Actin is polarized to this spot just prior to and during bud emergence."	"YAL041W,YAR014C,YBL061C,YBR023C,YBR079C,YBR102C,YBR109C,YBR200W,YCL024W,YCR038C,YDL127W,YDL179W,YDL240W,YDR166C,YDR309C,YER008C,YER144C,YER155C,YFL005W,YGL233W,YGR152C,YGR189C,YGR221C,YGR229C,YHL007C,YHR023W,YHR061C,YHR102W,YHR149C,YIL034C,YIL129C,YIL140W,YJL085W,YKL007W,YKL079W,YKL092C,YKL189W,YKR055W,YKR090W,YKR100C,YLL021W,YLR190W,YLR229C,YLR313C,YLR319C,YLR337C,YLR353W,YLR371W,YLR425W,YMR192W,YMR273C,YNL161W,YNL233W,YNL243W,YNL271C,YNL289W,YNL293W,YNL304W,YNR031C,YOL112W,YOR326W,YOR353C,YPL115C,YPL249C,YPR055W,YPR165W,YPR188C"
"GO:0000133"	"6"	"polarisome"	"极体"	"Protein complex that plays a role in determining cell polarity by directing the localized assembly of actin filaments at polarization sites; in Saccharomyces the polarisome includes Bni1p, Spa2p, Pea2p, and Bud6p."	"YER149C,YLL021W,YLR319C,YNL271C,YNL293W,YOL112W"
"GO:0000136"	"7"	"mannan polymerase complex"	"甘露聚糖聚合酶复合物"	"A protein complex with alpha-(1->6)-mannosyltransferase activity, located in the cis Golgi membrane; adds mannan to N-linked glycans on proteins."	"YDR245W,YEL036C,YGL038C,YJL183W,YJR075W,YML115C,YPL050C"
"GO:0000137"	"6"	"Golgi cis cisterna"	"高尔基体顺池"	"The Golgi cisterna closest to the endoplasmic reticulum; the first processing compartment through which proteins pass after export from the ER."	"YEL022W,YEL036C,YGL038C,YJR031C,YMR052W,YMR292W"
"GO:0000138"	"7"	"Golgi trans cisterna"	"高尔基跨池"	"The Golgi cisterna farthest from the endoplasmic reticulum; the final processing compartment through which proteins pass before exiting the Golgi apparatus; the compartment in which N-linked protein glycosylation is completed."	"YAR042W,YBL102W,YKL006C-A,YLR436C,YNL127W,YOR322C,YPR194C"
"GO:0000139"	"136"	"Golgi membrane"	"高尔基膜"	"The lipid bilayer surrounding any of the compartments of the Golgi apparatus."	"YAL042W,YAR042W,YBL069W,YBL102W,YBR015C,YBR187W,YCL001W,YCR067C,YDL058W,YDL121C,YDL145C,YDL149W,YDL226C,YDR072C,YDR084C,YDR100W,YDR137W,YDR141C,YDR189W,YDR238C,YDR245W,YDR264C,YDR367W,YDR372C,YDR373W,YDR483W,YDR503C,YDR517W,YEL036C,YEL042W,YER001W,YER005W,YER031C,YER039C,YER074W-A,YER083C,YER113C,YER122C,YER157W,YFL034W,YFL038C,YFL048C,YFR051C,YGL005C,YGL020C,YGL038C,YGL054C,YGL095C,YGL137W,YGL167C,YGL200C,YGL210W,YGL225W,YGL257C,YGR120C,YGR172C,YGR209C,YHL019C,YHL031C,YHR098C,YHR123W,YHR181W,YIL004C,YIL014W,YIL041W,YIL048W,YIL076W,YIL109C,YJL004C,YJL139C,YJL183W,YJR040W,YJR066W,YKL006C-A,YKL034W,YKL039W,YKL165C,YKL174C,YKL179C,YKL212W,YKR030W,YKR044W,YKR061W,YKR088C,YLR026C,YLR039C,YLR043C,YLR057W,YLR078C,YLR080W,YLR242C,YLR260W,YLR268W,YLR309C,YML012W,YML038C,YML067C,YML071C,YML115C,YMR010W,YMR054W,YMR071C,YMR079W,YMR197C,YMR292W,YNL006W,YNL024C-A,YNL041C,YNL044W,YNL049C,YNL051W,YNL204C,YNL263C,YNL287W,YNL297C,YOL107W,YOR034C,YOR069W,YOR079C,YOR099W,YOR171C,YOR216C,YOR320C,YOR357C,YPL010W,YPL050C,YPL145C,YPL218W,YPL246C,YPR028W,YPR029C,YPR095C,YPR105C,YPR109W,YPR159W,YPR181C"
"GO:0000142"	"13"	"cellular bud neck contractile ring"	"细胞芽颈收缩环"	"A contractile ring, i.e. a cytoskeletal structure composed of actin filaments and myosin, that forms beneath the plasma membrane at the mother-bud neck in mitotic cells that divide by budding in preparation for completing cytokinesis. An example of this structure is found in Saccharomyces cerevisiae."	"YCL014W,YDL117W,YFL039C,YGL106W,YIL034C,YIL138C,YJR090C,YJR092W,YMR032W,YNL079C,YNL152W,YPL242C,YPR188C"
"GO:0000144"	"13"	"cellular bud neck septin ring"	"细胞芽颈环"	"A ring-shaped structure that forms at the site of cytokinesis in the bud neck of a budding cell; composed of members of the conserved family of filament forming proteins called septins as well as septin-associated proteins. In S. cerevisiae, this structure forms at the time of bud emergence and the septins show a high rate of exchange."	"YBR133C,YCR002C,YCR030C,YDL225W,YEL040W,YHR107C,YIL140W,YJR076C,YKL048C,YKL101W,YLR314C,YMR032W,YNL166C"
"GO:0000145"	"9"	"exocyst"	"外囊肿"	"A protein complex peripherally associated with the plasma membrane that determines where vesicles dock and fuse. At least eight complex components are conserved between yeast and mammals."	"YBR102C,YDR166C,YER008C,YGL233W,YIL068C,YJL085W,YJL204C,YLR166C,YPR055W"
"GO:0000148"	"4"	"1,3-beta-D-glucan synthase complex"	"1,3-β-D-葡聚糖合酶复合物"	"A protein complex that catalyzes the transfer of a glucose group from UDP-glucose to a (1->3)-beta-D-glucan chain."	"YGR032W,YLR342W,YMR306W,YPR165W"
"GO:0000151"	"16"	"ubiquitin ligase complex"	"泛素连接酶复合物"	"A protein complex that includes a ubiquitin-protein ligase and enables ubiquitin protein ligase activity. The complex also contains other proteins that may confer substrate specificity on the complex."	"YBR082C,YDR059C,YER125W,YGR184C,YHR115C,YIL001W,YJR141W,YKR017C,YLR024C,YLR128W,YML068W,YML111W,YMR275C,YNL116W,YNR069C,YOR057W"
"GO:0000159"	"7"	"protein phosphatase type 2A complex"	"2A型蛋白磷酸酶复合物"	"A protein complex that has protein serine/threonine phosphatase activity that is polycation-stimulated (PCS), being directly stimulated by protamine, polylysine, or histone H1; it constitutes a subclass of several enzymes activated by different histones and polylysine, and consists of catalytic, scaffolding, and regulatory subunits. The catalytic and scaffolding subunits form the core enzyme, and the holoenzyme also includes the regulatory subunit."	"YAL016W,YDL047W,YDL134C,YGL190C,YIL153W,YOR014W,YPL152W"
"GO:0000164"	"10"	"protein phosphatase type 1 complex"	"蛋白磷酸酶1型复合物"	"A protein complex that possesses magnesium-dependent protein serine/threonine phosphatase (AMD phosphatase) activity, and consists of a catalytic subunit and one or more regulatory subunits that dictates the phosphatase's substrate specificity, function, and activity."	"YBR045C,YBR050C,YDR028C,YDR130C,YER054C,YER133W,YIL045W,YKL193C,YLR273C,YOR178C"
"GO:0000172"	"11"	"ribonuclease MRP complex"	"核糖核酸酶MRP复合物"	"A ribonucleoprotein complex that contains an RNA molecule of the snoRNA family, and cleaves the rRNA precursor as part of rRNA transcript processing. It also has other roles: In S. cerevisiae it is involved in cell cycle-regulated degradation of daughter cell-specific mRNAs, while in mammalian cells it also enters the mitochondria and processes RNAs to create RNA primers for DNA replication."	"YAL033W,YBL018C,YBR167C,YBR257W,YDR478W,YGR030C,YHR062C,YLR145W,YML017W,YNL221C,YNL282W"
"GO:0000176"	"12"	"nuclear exosome (RNase complex)"	"核外体（核糖核酸酶复合物）"	"A ribonuclease complex that has 3-prime to 5-prime processive and distributive hydrolytic exoribonuclease activity and endoribonuclease activity, producing 5-prime-phosphomonoesters. Participates in a multitude of cellular RNA processing and degradation events preventing nuclear export and/or translation of aberrant RNAs. Restricted to processing linear and circular single-stranded RNAs (ssRNA) only. RNAs with complex secondary structures may have to be unwound or pre-processed by co-factors prior to entering the complex, esp if the 3-prime end is structured."	"YCR035C,YDL111C,YDR280W,YGR095C,YGR158C,YGR195W,YHR069C,YNL232W,YOL021C,YOL142W,YOR001W,YPL146C"
"GO:0000177"	"10"	"cytoplasmic exosome (RNase complex)"	"细胞质外体（核糖核酸酶复合物）"	"A ribonuclease complex that has 3-prime to 5-prime processive hydrolytic exoribonuclease activity producing 5-prime-phosphomonoesters. Participates in a multitude of cellular RNA processing and degradation events preventing nuclear export and/or translation of aberrant RNAs. Restricted to processing linear and circular single-stranded RNAs (ssRNA) only. RNAs with complex secondary structures may have to be unwound or pre-processed by co-factors prior to entering the complex, esp if the 3-prime end is structured."	"YCR035C,YDL111C,YDR280W,YGR095C,YGR158C,YGR195W,YHR069C,YNL232W,YOL021C,YOL142W"
"GO:0000178"	"11"	"exosome (RNase complex)"	"外体（核糖核酸酶复合物）"	"A ribonuclease complex that has 3-prime to 5-prime exoribonuclease activity and possibly endoribonuclease activity, producing 5-prime-phosphomonoesters. Participates in a multitude of cellular RNA processing and degradation events preventing nuclear export and/or translation of aberrant RNAs. Restricted to processing linear and circular single-stranded RNAs (ssRNA) only. RNAs with complex secondary structures may have to be unwound or pre-processed by co-factors prior to entering the complex, esp if the 3-prime end is structured."	"YCR035C,YDL111C,YDR280W,YGR095C,YGR195W,YHR069C,YHR081W,YNL232W,YOL021C,YOL142W,YOR001W"
"GO:0000214"	"4"	"tRNA-intron endonuclease complex"	"tRNA内含子内切酶复合物"	"A protein complex that catalyzes the endonucleolytic cleavage of pre-tRNA, producing 5'-hydroxyl and 2',3'-cyclic phosphate termini, and specifically removing the intron."	"YAR008W,YLR105C,YMR059W,YPL083C"
"GO:0000220"	"7"	"vacuolar proton-transporting V-type ATPase, V0 domain"	"液泡质子转运V型ATP酶，V0结构域"	"The V0 domain of a proton-transporting V-type ATPase found in the vacuolar membrane."	"YCL005W-A,YEL027W,YHR026W,YLR447C,YMR054W,YOR270C,YPL234C"
"GO:0000221"	"7"	"vacuolar proton-transporting V-type ATPase, V1 domain"	"液泡质子转运V型ATP酶，V1结构域"	"The V1 domain of a proton-transporting V-type ATPase found in the vacuolar membrane."	"YBR127C,YDL185W,YGR020C,YHR039C-A,YKL080W,YOR332W,YPR036W"
"GO:0000228"	"16"	"nuclear chromosome"	"核染色体"	"A chromosome that encodes the nuclear genome and is found in the nucleus of a eukaryotic cell during the cell cycle phases when the nucleus is intact."	"YBR289W,YDL154W,YDR499W,YER095W,YFL003C,YGL213C,YHL022C,YHR124W,YJL072C,YLR321C,YLR394W,YML032C,YNL216W,YOL090W,YPL082C,YPR135W"
"GO:0000235"	"3"	"astral microtubule"	"星状微管"	"Any of the spindle microtubules that radiate in all directions from the spindle poles and are thought to contribute to the forces that separate the poles and position them in relation to the rest of the cell."	"YDR130C,YEL061C,YKR054C"
"GO:0000243"	"12"	"commitment complex"	"承诺情结"	"A spliceosomal complex that is formed by association of the U1 snRNP with the 5' splice site of an unspliced intron in an RNA transcript."	"YDR235W,YDR240C,YGR074W,YHR086W,YIL061C,YKL074C,YLR116W,YLR147C,YLR298C,YML046W,YMR125W,YPL178W"
"GO:0000262"	"6"	"mitochondrial chromosome"	"线粒体染色体"	"A chromosome found in the mitochondrion of a eukaryotic cell."	"YBL022C,YJR144W,YMR072W,YNL295W,YPL029W,YPL159C"
"GO:0000274"	"2"	"mitochondrial proton-transporting ATP synthase, stator stalk"	"线粒体质子转运ATP合酶"	"One of two stalks that connect the catalytic core of the hydrogen-transporting ATP synthase to the mitochondrial membrane-associated F0 proteins; is thought to prevent futile rotation of the catalytic core."	"YDR298C,YKL016C"
"GO:0000275"	"3"	"mitochondrial proton-transporting ATP synthase complex, catalytic sector F(1)"	"线粒体质子转运ATP合成酶复合物，催化区F（1）"	"The catalytic sector of the mitochondrial hydrogen-transporting ATP synthase; it comprises the catalytic core and central stalk, and is peripherally associated with the mitochondrial inner membrane when the entire ATP synthase is assembled."	"YBR039W,YDL004W,YPL271W"
"GO:0000276"	"12"	"mitochondrial proton-transporting ATP synthase complex, coupling factor F(o)"	"线粒体质子转运ATP合成酶复合物，耦合因子F（o）"	"All non-F1 subunits of the mitochondrial hydrogen-transporting ATP synthase, including integral and peripheral mitochondrial inner membrane proteins."	"Q0080,Q0085,Q0130,YDR322C-A,YDR377W,YKL016C,YLR295C,YML081C-A,YOL077W-A,YOR020W-A,YPL078C,YPR020W"
"GO:0000307"	"25"	"cyclin-dependent protein kinase holoenzyme complex"	"细胞周期素依赖性蛋白激酶全酶复合物"	"Cyclin-dependent protein kinases (CDKs) are enzyme complexes that contain a kinase catalytic subunit associated with a regulatory cyclin partner."	"YAL040C,YBR135W,YBR160W,YDL127W,YDL155W,YDL179W,YER059W,YGL134W,YGL215W,YGR108W,YGR109C,YHR071W,YIL050W,YKL161C,YLR210W,YLR226W,YMR199W,YNL289W,YOL001W,YPL031C,YPL219W,YPL256C,YPR119W,YPR120C,YPR161C"
"GO:0000323"	"1"	"lytic vacuole"	"溶解液泡"	"A vacuole that is maintained at an acidic pH and which contains degradative enzymes, including a wide variety of acid hydrolases."	"YLR360W"
"GO:0000324"	"257"	"fungal-type vacuole"	"真菌型液泡"	"A vacuole that has both lytic and storage functions. The fungal vacuole is a large, membrane-bounded organelle that functions as a reservoir for the storage of small molecules (including polyphosphate, amino acids, several divalent cations (e.g. calcium), other ions, and other small molecules) as well as being the primary compartment for degradation. It is an acidic compartment, containing an ensemble of acid hydrolases. At least in S. cerevisiae, there are indications that the morphology of the vacuole is variable and correlated with the cell cycle, with logarithmically growing cells having a multilobed, reticulated vacuole, while stationary phase cells contain a single large structure."	"YBL017C,YBL042C,YBR014C,YBR036C,YBR040W,YBR139W,YBR161W,YBR162C,YBR187W,YBR199W,YBR205W,YBR286W,YBR290W,YCL001W,YCL021W-A,YCL048W-A,YCL057W,YCR007C,YCR075C,YCR098C,YDL010W,YDL046W,YDL049C,YDL077C,YDL128W,YDL130W,YDL133W,YDL180W,YDL211C,YDL248W,YDR003W,YDR055W,YDR144C,YDR248C,YDR262W,YDR281C,YDR415C,YDR422C,YDR438W,YDR452W,YDR497C,YDR519W,YDR536W,YDR542W,YEL060C,YEL065W,YER011W,YER060W-A,YER119C,YER123W,YFL011W,YFL020C,YFL040W,YFL062W,YGL027C,YGL032C,YGL089C,YGL186C,YGL263W,YGR055W,YGR125W,YGR197C,YGR223C,YGR254W,YGR260W,YGR279C,YGR282C,YGR295C,YHL008C,YHL036W,YHL040C,YHL042W,YHL047C,YHL048W,YHR057C,YHR113W,YHR126C,YHR132C,YHR134W,YHR143W,YHR151C,YHR173C,YHR174W,YHR202W,YHR215W,YIL011W,YIL014W,YIL067C,YIL088C,YIL089W,YIL099W,YIL117C,YIL140W,YIL156W-B,YIL158W,YIL162W,YIL166C,YIL173W,YIR014W,YIR019C,YIR028W,YIR041W,YJL037W,YJL051W,YJL059W,YJL079C,YJL097W,YJL116C,YJL132W,YJL151C,YJL158C,YJL160C,YJL174W,YJL178C,YJL219W,YJL222W,YJR001W,YJR040W,YJR054W,YJR103W,YJR137C,YJR152W,YJR160C,YJR161C,YKL034W,YKL103C,YKL124W,YKL165C,YKL196C,YKL217W,YKL220C,YKL224C,YKR013W,YKR044W,YKR093W,YLL025W,YLL043W,YLL048C,YLL051C,YLR001C,YLR037C,YLR042C,YLR046C,YLR104W,YLR110C,YLR194C,YLR213C,YLR220W,YLR250W,YLR286C,YLR297W,YLR299W,YLR343W,YLR361C,YLR396C,YLR406C-A,YLR413W,YLR443W,YLR461W,YML001W,YML012W,YML047C,YML066C,YML104C,YML132W,YMR011W,YMR058W,YMR155W,YMR215W,YMR221C,YMR243C,YMR244W,YMR247W-A,YMR251W-A,YMR272W-B,YMR297W,YMR319C,YNL012W,YNL019C,YNL058C,YNL065W,YNL101W,YNL115C,YNL129W,YNL176C,YNL217W,YNL238W,YNL275W,YNL279W,YNL283C,YNL298W,YNL305C,YNL318C,YNL320W,YNL321W,YNL322C,YNL326C,YNL327W,YNL336W,YNR002C,YNR028W,YNR055C,YNR061C,YNR066C,YNR072W,YOL002C,YOL007C,YOL011W,YOL019W,YOL052C-A,YOL084W,YOL101C,YOL103W,YOL105C,YOL122C,YOL132W,YOL138C,YOL154W,YOL158C,YOL161C,YOR008C,YOR009W,YOR010C,YOR034C,YOR049C,YOR087W,YOR099W,YOR150W,YOR190W,YOR192C,YOR214C,YOR247W,YOR270C,YOR288C,YOR292C,YOR301W,YOR316C,YOR328W,YOR381W,YOR382W,YOR383C,YPL053C,YPL057C,YPL123C,YPL154C,YPL156C,YPL163C,YPL176C,YPL221W,YPL234C,YPL265W,YPR026W,YPR037C,YPR058W,YPR075C,YPR157W,YPR194C"
"GO:0000328"	"15"	"fungal-type vacuole lumen"	"真菌型液泡腔"	"The volume enclosed within the vacuolar membrane of a vacuole, the shape of which correlates with cell cycle phase. An example of this structure is found in Saccharomyces cerevisiae."	"YBR139W,YDL046W,YDL123W,YEL060C,YHR113W,YIL089W,YJL151C,YJL172W,YKR039W,YLR178C,YMR063W,YMR297W,YOL019W,YOR003W,YOR223W"
"GO:0000329"	"212"	"fungal-type vacuole membrane"	"真菌型液泡膜"	"The lipid bilayer surrounding a vacuole, the shape of which correlates with cell cycle phase. The membrane separates its contents from the cytoplasm of the cell. An example of this structure is found in Saccharomyces cerevisiae."	"YAL005C,YAL022C,YAR027W,YAR028W,YBL050W,YBL078C,YBL089W,YBR041W,YBR074W,YBR077C,YBR097W,YBR118W,YBR127C,YBR128C,YBR132C,YBR147W,YBR187W,YBR205W,YBR207W,YBR235W,YBR241C,YBR264C,YBR290W,YBR293W,YCL005W-A,YCL038C,YCL063W,YCL069W,YCR011C,YCR023C,YCR028C,YCR032W,YCR044C,YCR075W-A,YDL001W,YDL054C,YDL077C,YDL123W,YDL128W,YDL180W,YDL185W,YDL199C,YDL206W,YDL210W,YDR003W,YDR080W,YDR089W,YDR105C,YDR107C,YDR119W,YDR128W,YDR135C,YDR229W,YDR284C,YDR313C,YDR352W,YDR387C,YDR452W,YDR456W,YDR481C,YDR486C,YDR495C,YDR525W-A,YEL013W,YEL017C-A,YEL051W,YER017C,YER072W,YER119C,YER123W,YFL004W,YFL041W,YFL048C,YFL062W,YFR019W,YFR021W,YGL006W,YGL023C,YGL087C,YGL104C,YGL114W,YGL124C,YGL156W,YGL190C,YGL212W,YGL257C,YGR020C,YGR106C,YGR125W,YGR138C,YGR141W,YGR163W,YGR223C,YHL035C,YHR028C,YHR039C-A,YHR175W,YHR186C,YHR205W,YIL047C,YIL088C,YIL109C,YIR007W,YIR014W,YJL012C,YJL053W,YJL080C,YJL097W,YJL100W,YJL145W,YJL154C,YJL163C,YJR001W,YJR066W,YJR124C,YJR138W,YKL064W,YKL080W,YKL146W,YKL175W,YKR001C,YKR007W,YKR014C,YKR103W,YLL015W,YLL024C,YLL028W,YLL041C,YLL048C,YLL051C,YLR001C,YLR034C,YLR047C,YLR083C,YLR093C,YLR148W,YLR173W,YLR178C,YLR220W,YLR229C,YLR240W,YLR241W,YLR297W,YLR360W,YLR386W,YLR396C,YLR447C,YML001W,YML018C,YML066C,YML121W,YMR054W,YMR088C,YMR155W,YMR160W,YMR195W,YMR197C,YMR221C,YMR231W,YMR243C,YMR266W,YNL054W,YNL100W,YNL101W,YNL115C,YNL180C,YNL217W,YNL234W,YNL293W,YNL321W,YNL325C,YNL326C,YNL336W,YNR013C,YNR061C,YOL060C,YOL065C,YOL075C,YOL092W,YOL119C,YOL129W,YOR034C,YOR036W,YOR068C,YOR087W,YOR104W,YOR106W,YOR237W,YOR270C,YOR273C,YOR291W,YOR316C,YOR332W,YOR357C,YPL006W,YPL019C,YPL045W,YPL087W,YPL100W,YPL120W,YPL162C,YPL180W,YPL215W,YPL232W,YPL234C,YPL236C,YPL265W,YPR036W,YPR037C,YPR075C,YPR080W,YPR156C"
"GO:0000333"	"1"	"telomerase catalytic core complex"	"端粒酶催化核心复合物"	"The minimal catalytic core of telomerase is a ribonucleoprotein complex composed of a catalytic reverse transcriptase subunit and an RNA subunit that provides the template for telomeric DNA addition."	"YLR318W"
"GO:0000346"	"3"	"transcription export complex"	"转录输出复合体"	"The transcription export (TREX) complex couples transcription elongation by RNA polymerase II to mRNA export. The complex associates with the polymerase and travels with it along the length of the transcribed gene. TREX is composed of the THO transcription elongation complex as well as other proteins that couple THO to mRNA export proteins. The TREX complex is known to be found in a wide range of eukaryotes, including S. cerevisiae and metazoans."	"YDL084W,YDR381W,YNL253W"
"GO:0000347"	"1"	"THO complex"	"THO复合体"	"The THO complex is a nuclear complex that is required for transcription elongation through genes containing tandemly repeated DNA sequences. The THO complex is also part of the TREX (TRanscription EXport) complex that is involved in coupling transcription to export of mRNAs to the cytoplasm. In S. cerevisiae, it is composed of four subunits: Hpr1p, Tho2p, Thp1p, and Mft1p, while the human complex is composed of 7 subunits."	"YML062C"
"GO:0000407"	"36"	"phagophore assembly site"	"吞噬细胞组装位点"	"Punctate structures proximal to the endoplasmic reticulum which are the sites where the Atg machinery assembles upon autophagy induction."	"YBL078C,YBR128C,YBR254C,YDL113C,YDL149W,YDR022C,YDR108W,YDR246W,YDR472W,YEL013W,YFL038C,YFR021W,YGL180W,YGL212W,YHR171W,YJL036W,YJL083W,YJL178C,YKR019C,YKR068C,YLR211C,YLR240W,YLR423C,YLR431C,YML077W,YMR159C,YNL242W,YNR007C,YOL082W,YOR115C,YPL100W,YPL120W,YPL149W,YPL166W,YPR049C,YPR185W"
"GO:0000408"	"5"	"EKC/KEOPS complex"	"EKC/KEOPS综合设施"	"A protein complex involved in t6A tRNA modification. For example, in Saccharomyces cerevisiae the complex contains Bud32p, Kae1p, Gon7p, Cgi121p, and Pcc1p."	"YGR262C,YJL184W,YKR038C,YKR095W-A,YML036W"
"GO:0000417"	"4"	"HIR complex"	"HIR复合体"	"A protein complex proposed to be involved in replication-independent nucleosome assembly, by promoting histone deposition onto DNA. For example, in Saccharomyces, the complex contains Hir1p, Hir2p, Hir3p, and Hpc2p."	"YBL008W,YBR215W,YJR140C,YOR038C"
"GO:0000421"	"7"	"autophagosome membrane"	"自噬体膜"	"The lipid bilayer surrounding an autophagosome, a double-membrane-bounded vesicle in which endogenous cellular material is sequestered."	"YBL078C,YER072W,YFL004W,YGL180W,YJL012C,YKL196C,YPL019C"
"GO:0000428"	"3"	"DNA-directed RNA polymerase complex"	"脱氧核糖核酸聚合酶复合体"	"A protein complex that possesses DNA-directed RNA polymerase activity."	"YJL140W,YJL148W,YOR210W"
"GO:0000439"	"7"	"transcription factor TFIIH core complex"	"转录因子TFIIH核心复合物"	"The 7 subunit core of TFIIH that is a part of either the general transcription factor holo-TFIIH or the nucleotide-excision repair factor 3 complex. In S. cerevisiae/humans the complex is composed of: Ssl2/XPB, Tfb1/p62, Tfb2/p52, Ssl1/p44, Tfb4/p34, Tfb5/p8 and Rad3/XPD."	"YDR079C-A,YDR311W,YER171W,YIL143C,YLR005W,YPL122C,YPR056W"
