"id"	"geneNum"	"description"	"BaiduTrans"	"definition"	"gene"
"GO:0032432"	"7"	"actin filament bundle"	"肌动蛋白丝束"	"An assembly of actin filaments that are on the same axis but may be oriented with the same or opposite polarities and may be packed with different levels of tightness."	"YDR126W,YDR129C,YFL039C,YIL138C,YNL079C,YOR239W,YOR326W"
"GO:0032473"	"2"	"cytoplasmic side of mitochondrial outer membrane"	"线粒体外膜细胞质侧"	"The external (cytoplasmic) face of the mitochondrial outer membrane."	"YJR091C,YLL013C"
"GO:0032541"	"26"	"cortical endoplasmic reticulum"	"皮质内质网"	"A cortical network of highly dynamic tubules that are juxtaposed to the plasma membrane and undergo ring closure and tubule-branching movements."	"YBR086C,YBR183W,YDL019C,YDL204W,YDR233C,YDR294C,YDR326C,YFL042C,YHR001W,YHR073W,YHR080C,YHR155W,YIL090W,YJL145W,YKL212W,YKR003W,YLR072W,YLR242C,YLR404W,YML072C,YNL087W,YNL257C,YOR086C,YOR152C,YOR165W,YOR171C"
"GO:0032545"	"4"	"CURI complex"	"居里复合体"	"A protein complex that is involved in the transcription of ribosomal genes. In Saccharomyces this complex consists of Ckb2p, Utp22p, Rrp7p and Ifh1p."	"YCL031C,YGR090W,YLR223C,YOR039W"
"GO:0032580"	"2"	"Golgi cisterna membrane"	"高尔基体池膜"	"The lipid bilayer surrounding any of the thin, flattened compartments that form the central portion of the Golgi complex."	"YDR372C,YKL004W"
"GO:0032585"	"3"	"multivesicular body membrane"	"多泡体膜"	"The lipid bilayer surrounding a multivesicular body."	"YBR131W,YCR068W,YGL124C"
"GO:0032588"	"1"	"trans-Golgi network membrane"	"跨高尔基网络膜"	"The lipid bilayer surrounding any of the compartments that make up the trans-Golgi network."	"YMR010W"
"GO:0032777"	"3"	"Piccolo NuA4 histone acetyltransferase complex"	"Piccolo NuA4组蛋白乙酰转移酶复合物"	"A heterotrimeric H4/H2A histone acetyltransferase complex with a substrate preference of chromatin over free histones. It contains a subset of the proteins found in the larger NuA4 histone acetyltransferase complex; for example, the S. cerevisiae complex contains Esa1p, Yng2p, and Epl1p."	"YFL024C,YHR090C,YOR244W"
"GO:0032798"	"1"	"Swi5-Sfr1 complex"	"Swi5-Sfr1复合物"	"A conserved DNA recombinase mediator complex that contains two Swi5 monomers and one Sfr1 monomer in Schizosaccharomyces, or orthologs thereof (e.g. Sae3p and Mei5p in Saccharomyces)."	"YHR079C-A"
"GO:0032807"	"3"	"DNA ligase IV complex"	"DNA连接酶IV复合物"	"A eukaryotically conserved protein complex that contains DNA ligase IV and is involved in DNA repair by non-homologous end joining; in addition to the ligase, the complex also contains XRCC4 or a homolog, e.g. Saccharomyces Lif1p."	"YGL090W,YLR265C,YOR005C"
"GO:0032865"	"6"	"ERMES complex"	"埃尔姆斯复合体"	"A protein complex that links the endoplasmic reticulum with mitochondria and may have a role in promoting exchange of calcium and phospholipids between the two organelles."	"YAL010C,YAL048C,YGL219C,YLL006W,YOL009C,YPR091C"
"GO:0032982"	"1"	"myosin filament"	"肌球蛋白丝"	"A supramolecular fiber containing myosin heavy chains, plus associated light chains and other proteins, in which the myosin heavy chains are arranged into a filament."	"YHR023W"
"GO:0032991"	"33"	"protein-containing complex"	"含蛋白质复合物"	"A stable assembly of two or more macromolecules, i.e. proteins, nucleic acids, carbohydrates or lipids, in which at least one component is a protein and the constituent parts function together."	"YBL026W,YBR055C,YBR128C,YBR254C,YCR020C-A,YDR235W,YDR246W,YDR292C,YDR416W,YDR449C,YEL048C,YER029C,YER146W,YFL017W-A,YHL019C,YHR041C,YJL124C,YJR022W,YJR066W,YKL203C,YLR117C,YLR275W,YML046W,YML077W,YMR061W,YMR186W,YMR190C,YMR229C,YNL147W,YOL062C,YOR159C,YPL045W,YPL240C"
"GO:0032993"	"1"	"protein-DNA complex"	"蛋白质DNA复合物"	"A macromolecular complex containing both protein and DNA molecules."	"YER142C"
"GO:0033063"	"1"	"Rad51B-Rad51C-Rad51D-XRCC2 complex"	"Rad51B-Rad51C-Rad51D-XRCC2复合物"	"A DNA recombinase mediator complex that contains the Rad51 paralogs RAD51B, RAD51C, RAD51D, and XRCC2, or orthologs thereof."	"YDR076W"
"GO:0033065"	"2"	"Rad51C-XRCC3 complex"	"Rad51C-XRCC3复合物"	"A DNA recombinase mediator complex that contains the Rad51 paralogs RAD51C and XRCC3, or orthologs thereof."	"YDR004W,YDR076W"
"GO:0033100"	"6"	"NuA3 histone acetyltransferase complex"	"NuA3组蛋白乙酰转移酶复合物"	"A Gcn5-independent multisubunit complex that catalyzes the acetylation of histone H3. The budding yeast complex includes Sas3p, Taf30p, and Yng1p."	"YBL052C,YJR082C,YLR455W,YOR064C,YPL129W,YPR031W"
"GO:0033101"	"7"	"cellular bud membrane"	"细胞芽膜"	"The portion of the plasma membrane surrounding a cellular bud."	"YBR016W,YBR086C,YKR100C,YLL028W,YNR049C,YOL158C,YPR149W"
"GO:0033106"	"1"	"cis-Golgi network membrane"	"顺式高尔基网络膜"	"The lipid bilayer surrounding any of the compartments that make up the cis-Golgi network."	"YKR068C"
"GO:0033110"	"1"	"Cvt vesicle membrane"	"Cvt囊泡膜"	"Either of the two lipid bilayers surrounding a Cvt vesicle, a vesicle that functions in the cytoplasm-to-vacuole targeting (Cvt) pathway."	"YBL078C"
"GO:0033116"	"2"	"endoplasmic reticulum-Golgi intermediate compartment membrane"	"内质网高尔基中间室膜"	"The lipid bilayer surrounding any of the compartments of the endoplasmic reticulum (ER)-Golgi intermediate compartment system."	"YGR105W,YPR091C"
"GO:0033177"	"2"	"proton-transporting two-sector ATPase complex, proton-transporting domain"	"质子转运双区ATP酶复合物，质子转运域"	"A protein complex that forms part of a proton-transporting two-sector ATPase complex and carries out proton transport across a membrane. The proton-transporting domain (F0, V0, or A0) includes integral and peripheral membrane proteins."	"YHR026W,YPL234C"
"GO:0033178"	"1"	"proton-transporting two-sector ATPase complex, catalytic domain"	"质子传输双扇形ATP酶复合物，催化结构域"	"A protein complex that forms part of a proton-transporting two-sector ATPase complex and catalyzes ATP hydrolysis or synthesis. The catalytic domain (F1, V1, or A1) comprises a hexameric catalytic core and a central stalk, and is peripherally associated with the membrane when the two-sector ATPase is assembled."	"YOR332W"
"GO:0033179"	"6"	"proton-transporting V-type ATPase, V0 domain"	"质子转运V型ATP酶，V0结构域"	"A protein complex that forms part of a proton-transporting V-type ATPase and mediates proton transport across a membrane. The V0 complex consists of at least four different subunits (a,c,d and e); six or more c subunits form a proton-binding rotor ring."	"YCL005W-A,YHR026W,YLR447C,YMR054W,YOR270C,YPL234C"
"GO:0033180"	"2"	"proton-transporting V-type ATPase, V1 domain"	"质子转运V型ATP酶，V1结构域"	"A protein complex that forms part of a proton-transporting V-type ATPase and catalyzes ATP hydrolysis. The V1 complex consists of: (1) a globular headpiece with three alternating copies of subunits A and B that form a ring, (2) a central rotational stalk composed of single copies of subunits D and F, and (3) a peripheral stalk made of subunits C, E, G and H. Subunits A and B mediate the hydrolysis of ATP at three reaction sites associated with subunit A."	"YGR020C,YKL080W"
"GO:0033186"	"3"	"CAF-1 complex"	"CAF-1复合体"	"A conserved heterotrimeric protein complex that promotes histone H3 and H4 deposition onto newly synthesized DNA during replication or DNA repair; specifically facilitates replication-dependent nucleosome assembly with the major histone H3 (H3.1). In many species the CAF-1 subunits are designated p150, p60, and p48."	"YBR195C,YML102W,YPR018W"
"GO:0033203"	"1"	"DNA helicase A complex"	"DNA解旋酶A复合物"	"A homohexameric protein complex that possesses DNA helicase activity; associates with DNA polymerase alpha-primase and translocates in the 5' to 3' direction."	"YKL017C"
"GO:0033254"	"5"	"vacuolar transporter chaperone complex"	"液泡转运蛋白伴侣复合物"	"A protein complex that contains four related proteins that have been implicated in several membrane-related processes, such as sorting of H+-translocating ATPases, endocytosis, ER-Golgi trafficking, vacuole fusion, vacuolar polyphosphate homeostasis and the microautophagic scission of vesicles into the vacuolar lumen. The complex is enriched at the vacuolar membrane, but also found in other cellular compartments, including the ER and the cell periphery. In Saccharomyces, the subunits are Vtc1p, Vtc2p, Vtc3p and Vtc4p."	"YDR089W,YER072W,YFL004W,YJL012C,YPL019C"
"GO:0033255"	"3"	"SAS acetyltransferase complex"	"SAS乙酰转移酶复合物"	"A protein complex that possesses histone acetyltransferase activity and links histone acetylation to the assembly of transcriptionally silent chromatin. In vitro, the complex acetylates lysine 16 of histone H4 and lysine 14 of histone H3, although the latter may not be relevant in vivo. The complex contains a catalytic subunit and at least two other subunits; in Saccharomyces, the catalytic subunit is Sas2p and additional subunits are Sas4p and Sas5p."	"YDR181C,YMR127C,YOR213C"
"GO:0033263"	"6"	"CORVET complex"	"科尔维特复合体"	"A multimeric protein complex that acts as an endosomal tethering complex (CORVET = class C core vacuole/endosome tethering) by cooperating with Rab GTPases to capture endosomal vesicles and trap them prior to the action of SNAREs; the complex is involved in endo-lysosomal biogenesis and required for transport between endosome and vacuole. The Saccharomyces cerevisiae complex contains Vps8p, Vps3p, Pep5p, Vps16p, Pep3p, and Vps33p."	"YAL002W,YDR495C,YLR148W,YLR396C,YMR231W,YPL045W"
"GO:0033290"	"11"	"eukaryotic 48S preinitiation complex"	"真核48S预起始复合物"	"A protein complex composed of the small ribosomal subunit, eIF3, eIF1A, methionyl-initiatior methionine and a capped mRNA. The complex is initially positioned at the 5'-end of the capped mRNA."	"YAL035W,YBR079C,YDR429C,YER025W,YJR007W,YLR192C,YMR146C,YMR260C,YMR309C,YOR361C,YPR041W"
"GO:0033309"	"8"	"SBF transcription complex"	"SBF转录复合物"	"A protein complex that binds to the Swi4/6 cell cycle box (SCB) promoter element, consensus sequence CRCGAAA, and activates transcription during the G1/S transition of the cell cycle. In Saccharomyces, the complex contains a heterodimer of the DNA binding protein Swi4p and the activator Swi6p, and is associated with additional proteins known as Whi5p and Msa1p."	"YDL056W,YER111C,YIL101C,YKR091W,YLR182W,YNL309W,YOR083W,YPL239W"
"GO:0033503"	"2"	"HULC complex"	"HULC复合体"	"A ubiquitin ligase complex that contains two RING finger proteins, which have ubiquitin ligase activity, in addition to a protein with ubiquitin-conjugating enzyme activity; catalyzes the ubiquitination of histone H2B at lysine 119 (or the equivalent residue). In Schizosaccharomyces the subunits are Rhp6, Shf1, Brl2/Rfp1 and Brl1/Rfp2."	"YDL074C,YGL058W"
"GO:0033551"	"4"	"monopolin complex"	"垄断者复合体"	"A protein complex required for clamping microtubule binding sites, ensuring orientation of sister kinetochores to the same pole (mono-orientation) during meiosis I. In the yeast S. cerevisiae this complex consists of Csm1p, Lrs4p, Hrr25p and Mam1p; in S. pombe Psc1 and Mde4 have been identified as subunits."	"YCR086W,YDR439W,YER106W,YPL204W"
"GO:0033553"	"8"	"rDNA heterochromatin"	"rDNA异染色质"	"A region of heterochromatin located at the rDNA repeats in a chromosome."	"YDR026C,YDR110W,YDR174W,YDR398W,YGR128C,YJL109C,YMR093W,YPL126W"
"GO:0033557"	"2"	"Slx1-Slx4 complex"	"Slx1-Slx4复合体"	"A heterodimeric protein complex that possesses an endonuclease activity that specifically cleaves certain types of branched DNA structures; because such structures often form during the replication ribosomal DNA (rDNA) repeats, the complex plays a role in the maintenance of rDNA. The subunits are known as Slx1 and Slx 4 in budding and fission yeasts, and are conserved in eukaryotes."	"YBR228W,YLR135W"
"GO:0033565"	"3"	"ESCRT-0 complex"	"ESCRT-0复合体"	"A protein complex required for the recycling of Golgi proteins, formation of lumenal membranes and sorting of ubiquitinated proteins into those membranes. This complex includes Vps1p and Hse1p in yeast and the Hrs and STAM proteins in mammals."	"YGR136W,YHL002W,YNR006W"
"GO:0033573"	"4"	"high-affinity iron permease complex"	"高亲和力铁通透性复合体"	"A protein complex composed of a multicopper ferroxidase that oxidizes Fe(II) to Fe(III), and a ferric iron permease that transports the produced Fe(III) into the cell. In high-affinity transport the transporter is able to bind the solute even if it is only present at very low concentrations."	"YBR207W,YDR506C,YER145C,YMR058W"
"GO:0033588"	"6"	"elongator holoenzyme complex"	"伸长体全酶复合物"	"A heterohexameric protein complex composed two discrete heterotrimeric subcomplexes that is involved in modification of wobble nucleosides in tRNA."	"YGR200C,YHR187W,YLR384C,YMR312W,YPL086C,YPL101W"
"GO:0033597"	"4"	"mitotic checkpoint complex"	"有丝分裂检查点复合体"	"A multiprotein complex that functions as a mitotic checkpoint inhibitor of the anaphase-promoting complex/cyclosome (APC/C). In budding yeast this complex consists of Mad2p, Mad3p, Bub3p and Cdc20p, and in mammalian cells it consists of MAD2, BUBR1, BUB3, and CDC20."	"YGL116W,YJL013C,YJL030W,YOR026W"
"GO:0033698"	"16"	"Rpd3L complex"	"Rpd3L复合物"	"A histone deacetylase complex which deacetylates histones preferentially in promoter regions. Composed of a catalytic histone deacetylase subunit, an Sds-3 family protein, a SIN3 family co-repressor, a WD repeat protein, and a zf- PHD finger (Clr6, Sds3, Pst1, Prw1, Png2 in Schizosaccharomyces pombe; Rpd3p, Sin3p, Ume1p, Pho23p, Sap30p, Sds3p, Cti6p, Rxt2p, Rxt3p, Dep1p, Ume6p and Ash1p in Saccharomyces cerevisiae)."	"YAL013W,YBR095C,YBR195C,YDL076C,YDR207C,YEL056W,YIL084C,YKL185W,YMR263W,YNL097C,YNL330C,YOL004W,YOR229W,YOR230W,YPL139C,YPL181W"
"GO:0033768"	"2"	"SUMO-targeted ubiquitin ligase complex"	"SUMO靶向泛素连接酶复合物"	"A nuclear ubiquitin ligase complex that specifically targets SUMOylated proteins; the complex is formed of homodimers or heterodimers of RNF4 family ubiquitin ligases and is conserved in eukaryotes."	"YDL013W,YER116C"
"GO:0034044"	"5"	"exomer complex"	"外聚体复合物"	"A protein complex that forms a coat structure on vesicles involved in exocytosis of proteins from the trans-Golgi network to the cell surface; in Saccharomyces, the complex contains Chs5p, Chs6p, and Chs6p paralogues."	"YJL099W,YKR027W,YLR330W,YMR237W,YOR299W"
"GO:0034045"	"25"	"phagophore assembly site membrane"	"吞噬细胞组装位点膜"	"A cellular membrane associated with the phagophore assembly site."	"YBR128C,YBR217W,YDL113C,YDL149W,YFL038C,YFR021W,YGL180W,YGR223C,YIL146C,YJL036W,YLL042C,YLR211C,YLR312C,YLR423C,YLR431C,YMR159C,YNL242W,YOL082W,YOL083W,YOR152C,YPL100W,YPL120W,YPL149W,YPL250C,YPR049C"
"GO:0034066"	"2"	"Ric1-Rgp1 guanyl-nucleotide exchange factor complex"	"Ric1-Rgp1鸟苷核苷酸交换因子复合物"	"A protein complex that acts as a nucleotide exchange factor for the GTPase Ypt6p, and is required for fusion of endosome-derived vesicles with the Golgi."	"YDR137W,YLR039C"
"GO:0034098"	"3"	"VCP-NPL4-UFD1 AAA ATPase complex"	"VCP-NPL4-UFD1 AAA ATP酶复合物"	"A multiprotein ATPase complex required for the efficient dislocation of ER-lumenal degradation substrates, and their subsequent proteolysis by the proteasome. In budding yeast, this complex includes Cdc48p, Npl4p and Ufd1p proteins. In mammals, this complex includes a hexamer of VCP/p97 (a cytosolic ATPase) and trimers of each of its cofactors UFD1L and NPL4 (NPLOC4) (e.g. a 6:3:3 stoichiometry)."	"YBR170C,YDL126C,YGR048W"
"GO:0034099"	"3"	"luminal surveillance complex"	"管腔监视复合体"	"A multiprotein complex that recognizes ERAD-luminal misfolded substrates and brings them to the ubiquitination/extraction machinery. In yeast, this complex consists of Yos9p, Kar2p and Hrd3p proteins."	"YDR057W,YJL034W,YLR207W"
"GO:0034245"	"2"	"mitochondrial DNA-directed RNA polymerase complex"	"线粒体DNA定向RNA聚合酶复合物"	"A DNA-directed RNA polymerase complex located in the mitochondrion. Mitochondrial RNA polymerase is composed of two subunits, a catalytic core, which resembles the enzymes from bacteriophage T7 and T3, and a specificity factor required for promoter recognition, which is similar to members of the eubacterial sigma factor family. In S. cerevisiae, these are encoded by the nuclear genes RPO41 and MTF1 and the specificity factor, required for promoter recognition and initiation, is not present in the elongating form."	"YFL036W,YMR228W"
"GO:0034270"	"4"	"Cvt complex"	"Cvt复合物"	"A protein complex that is involved in the Cvt pathway. In budding yeast, the Cvt complex consists of multimers of preApe1p."	"YGL156W,YKL103C,YOL082W,YOL083W"
"GO:0034271"	"5"	"phosphatidylinositol 3-kinase complex, class III, type I"	"磷脂酰肌醇3-激酶复合物，III类，I型"	"A class III phosphatidylinositol 3-kinase complex that is involved in autophagy. In budding yeast, this complex consists of Vps30p, Vps34p, Apg14p and Vps15p."	"YBR097W,YBR128C,YLR211C,YLR240W,YPL120W"
"GO:0034272"	"4"	"phosphatidylinositol 3-kinase complex, class III, type II"	"磷脂酰肌醇3-激酶复合物，III类，II型"	"A class III phosphatidylinositol 3-kinase complex that is involved in vacuolar protein sorting (VPS) via endosomes. In budding yeast, this complex consists of Vps30p, Vps34p, Vps38 and Vps15p."	"YBR097W,YLR240W,YLR360W,YPL120W"
"GO:0034274"	"3"	"Atg12-Atg5-Atg16 complex"	"Atg12-Atg5-Atg16复合体"	"A protein complex required for the expansion of the autophagosomal membrane. In budding yeast, this complex consists of Atg12p, Atg5p and Atg16p."	"YBR217W,YMR159C,YPL149W"
"GO:0034388"	"6"	"Pwp2p-containing subcomplex of 90S preribosome"	"含有90S前核糖体亚复合物的Pwp2p"	"A protein complex that forms a subcomplex of the 90S preribosome and can interact directly with the 5' External Transcribed Spacer (ETS) of the full length pre-rRNA transcript. In S. cerevisiae, it sediments at 25-30 S and is composed of Pwp2p, Dip2p, Utp21p, Utp13p, Utp18p, and Utp6p."	"YCR057C,YDR449C,YJL069C,YLR129W,YLR222C,YLR409C"
"GO:0034399"	"52"	"nuclear periphery"	"核外围"	"The portion of the nuclear lumen proximal to the inner nuclear membrane."	"YBL084C,YBR281C,YCL061C,YDL089W,YDL156W,YDL188C,YDR075W,YDR118W,YDR364C,YDR412W,YDR424C,YDR458C,YEL017W,YFR033C,YGL194C,YGR142W,YHR133C,YHR195W,YIL106W,YJL019W,YJL041W,YJR132W,YKL164C,YKL172W,YLL026W,YLR018C,YLR085C,YLR126C,YLR186W,YLR401C,YLR450W,YML034W,YML075C,YML085C,YMR119W,YMR129W,YMR219W,YMR307W,YNL006W,YNL008C,YNL077W,YNL085W,YNL325C,YNL330C,YOR074C,YOR160W,YOR294W,YPL192C,YPL243W,YPL246C,YPR035W,YPR174C"
"GO:0034424"	"2"	"Vps55/Vps68 complex"	"Vps55/Vps68复合体"	"A membrane-associated protein complex that is required for a late stage of endosomal transport. In budding yeast, this complex consists of Vps55p and Vps68p proteins."	"YJR044C,YOL129W"
"GO:0034455"	"7"	"t-UTP complex"	"t-UTP复合物"	"A protein complex that forms a subcomplex of the 90S preribosome and is required for the subsequent assembly of the rest of the preribosome. In S. cerevisiae, it is composed of Utp5p, Utp4p, Nan1p, Utp8p, Utp9p, Utp10 and Utp15p."	"YDR324C,YDR398W,YGR128C,YHR196W,YJL109C,YMR093W,YPL126W"
"GO:0034456"	"5"	"UTP-C complex"	"UTP-C复合物"	"A protein complex that forms a subcomplex of the 90S preribosome. In S. cerevisiae, it is composed of Rrp7p, Utp22p, Ckb1p, Cka1p, Ckb2p and Cka2p."	"YCL031C,YGL019W,YGR090W,YIL035C,YOR039W"
"GO:0034457"	"3"	"Mpp10 complex"	"Mpp10复合体"	"A protein complex that forms a subcomplex of the 90S preribosome. In S. cerevisiae, it is composed of Mpp10p, Imp3p and Imp4p."	"YHR148W,YJR002W,YNL075W"
"GO:0034515"	"25"	"proteasome storage granule"	"蛋白酶体贮存颗粒"	"An aggregation of proteasome core protease (CP) and regulatory particle (RP) complexes that localizes in the cytoplasm as dot-like structures when cells are in a quiescent state."	"YDL097C,YDL147W,YDR363W-A,YDR427W,YER012W,YER094C,YFL007W,YFR004W,YFR050C,YFR052W,YGL011C,YGL048C,YGR135W,YGR253C,YHR027C,YIL075C,YJL001W,YLR421C,YML092C,YMR314W,YOL038W,YOR157C,YOR261C,YOR362C,YPR103W"
"GO:0034657"	"8"	"GID complex"	"GID复合体"	"A protein complex with ubiquitin ligase activity that is involved in proteasomal degradation of fructose-1,6-bisphosphatase (FBPase) and phosphoenolpyruvate carboxykinase during the transition from gluconeogenic to glycolytic growth conditions. In S. cerevisiae, the GID (Glucose Induced degradation Deficient) complex consists of Vid30p, Rmd5p, Vid24p, Vid28p, Gid7p, Gid8p, and Fyv10p."	"YBR105C,YCL039W,YDR255C,YGL227W,YGR066C,YIL017C,YIL097W,YMR135C"
"GO:0034663"	"2"	"endoplasmic reticulum chaperone complex"	"内质网伴侣复合体"	"A protein complex that is located in the endoplasmic reticulum and is composed of chaperone proteins, including BiP, GRP94; CaBP1, protein disulfide isomerase (PDI), ERdj3, cyclophilin B, ERp72, GRP170, UDP-glucosyltransferase, and SDF2-L1."	"YJL034W,YKL073W"
"GO:0034707"	"1"	"chloride channel complex"	"氯离子通道复合体"	"An ion channel complex through which chloride ions pass."	"YJR040W"
"GO:0034715"	"6"	"pICln-Sm protein complex"	"pICln-Sm蛋白复合物"	"A protein complex that contains pICln (CLNS1A) and several Sm proteins, including SmD1, SmD2, SmE, SmF, and SmG."	"YGR074W,YKL183W,YLR147C,YLR275W,YOR159C,YPR182W"
"GO:0034719"	"3"	"SMN-Sm protein complex"	"SMN-Sm蛋白复合物"	"A protein complex formed by the association of several methylated Sm proteins with the SMN complex; the latter contains the survival motor neuron (SMN) protein and at least eight additional integral components, including the Gemin2-8 and unrip proteins; additional proteins, including galectin-1 and galectin-3, are also found in the SMN-SM complex. The SMN-Sm complex is involved in spliceosomal snRNP assembly in the cytoplasm."	"YFL017W-A,YGR074W,YLR147C"
"GO:0034967"	"8"	"Set3 complex"	"Set3复合体"	"A histone deacetylase complex that is involved in transcriptional regulation. In S. cerevisiae, this complex consists of Set3p, Snt1p, Hos4p, Sif2p, Cpr1p, Hos2p, and Hst1p."	"YBR103W,YCR033W,YDR155C,YGL194C,YIL112W,YJL105W,YKR029C,YOL068C"
"GO:0034973"	"2"	"Sid2-Mob1 complex"	"Sid2-Mob1复合体"	"A protein complex that contains a protein kinase (Sid2 in S. pombe) and its regulatory subunit (Mob1). The Sid2p-Mob1p kinase complex is a component of the septation initiation network in fission yeast (called the mitotic exit network in S. cerevisiae) and is required for cytokinesis. The analogous complex in S. cerevisiae is called Dbf2p-Mob1p complex."	"YGR092W,YIL106W"
"GO:0034974"	"1"	"Swi5-Swi2 complex"	"Swi5-Swi2复合体"	"A protein complex involved that contains proteins known in Schizosaccharomyces as Swi5 monomers and Swi2, and is involved in mating type switching."	"YHR079C-A"
"GO:0034993"	"2"	"meiotic nuclear membrane microtubule tethering complex"	"减数分裂核膜微管栓系复合体"	"A nuclear membrane  protein complex  which connects the nuclear outer and inner membranes together, and links links the nuclear lumen to cytoplasmic microtubules during meiosis."	"YGL075C,YJL019W"
"GO:0034998"	"1"	"oligosaccharyltransferase I complex"	"寡糖基转移酶Ⅰ复合物"	"An oligosaccharyltransferase (OST) complex that contains at least seven polypeptides and is the major OST complex in mammalian cells. Of the three forms of mammalian OST complex identified, the OSTI complex has the weakest affinity for ribosomes."	"YGL226C-A"
"GO:0035101"	"2"	"FACT complex"	"事实情结"	"A histone chaperone complex that facilitates nucleosome disassembly and reassembly upon DNA or RNA polymerase passage."	"YGL207W,YML069W"
"GO:0035145"	"1"	"exon-exon junction complex"	"外显子-外显子连接复合体"	"A multi-subunit complex deposited by the spliceosome upstream of messenger RNA exon-exon junctions. The exon-exon junction complex provides a binding platform for factors involved in mRNA export and nonsense-mediated mRNA decay."	"YHR077C"
"GO:0035267"	"16"	"NuA4 histone acetyltransferase complex"	"NuA4组蛋白乙酰转移酶复合物"	"A complex having histone acetylase activity on chromatin, as well as ATPase, DNA helicase and structural DNA binding activities. The complex is thought to be involved in double-strand DNA break repair. Subunits of the human complex include HTATIP/TIP60, TRRAP, RUVBL1, BUVBL2, beta-actin and BAF53/ACTL6A. In yeast, the complex has 13 subunits, including the catalytic subunit Esa1 (homologous to human Tip60)."	"YDR190C,YDR359C,YEL018W,YFL024C,YFL039C,YGR002C,YHR090C,YHR099W,YJL081C,YJR082C,YNL107W,YNL136W,YOR244W,YPL235W,YPR023C,YPR034W"
"GO:0035339"	"6"	"SPOTS complex"	"斑点复合体"	"A multiprotein complex at least composed of serine palmitoyltransferases and ORM proteins (known as ORMDL proteins in mammals and other higher vertebrates) that plays a key role in sphingolipid homeostasis."	"YBR058C-A,YDR062W,YGR038W,YKL212W,YLR350W,YMR296C"
"GO:0035361"	"5"	"Cul8-RING ubiquitin ligase complex"	"Cul8环泛素连接酶复合物"	"A ubiquitin ligase complex in which a cullin from the Cul8 subfamily and a RING domain protein form the catalytic core. In S. cerevisiae, Mms1p acts as the adaptor protein and substrate specificity is conferred by any of a number of different proteins."	"YHR154W,YJL047C,YLR320W,YOL133W,YPR164W"
